{
	"$schema": "../../../schema/affrescoui-scenarios.schema.json",
	"format": "affrescoui-scenarios",
	"version": 1,
	"note": "What the Habit tracker template (Streak) does, checked headless: affrescoui test habit-tracker.scenarios.json",
	"screen": "habit-tracker.screen.json",
	"scenarios": [
		{
			"name": "check-a-habit",
			"note": "Clicking an unchecked habit ticks it, adds a day to its streak and counts it as done today",
			"steps": [
				{ "expect": { "node": "#doneCount", "text": "2 of 5 done" } },
				{ "click": "#habit", "nth": 2 },
				{ "expect": { "state": "habits[2].done", "is": true } },
				{ "expect": { "state": "habits[2].streak", "is": 32 } },
				{ "expect": { "node": "#checkbox-habit", "nth": 2, "property": "checked", "is": true } },
				{ "expect": { "node": "#label-habit-streak-0", "nth": 2, "text": "32 day streak" } },
				{ "expect": { "node": "#doneCount", "text": "3 of 5 done" } },
				{ "expect": { "node": "#label-stat-value", "nth": 1, "text": "32 days" } }
			]
		},
		{
			"name": "uncheck-a-habit",
			"note": "Clicking the checkbox of a done habit unticks it and takes the day back off its streak",
			"steps": [
				{ "click": "#checkbox-habit", "nth": 0 },
				{ "expect": { "state": "habits[0].done", "is": false } },
				{ "expect": { "state": "habits[0].streak", "is": 11 } },
				{ "expect": { "node": "#checkbox-habit", "nth": 0, "property": "checked", "is": false } },
				{ "expect": { "node": "#label-stat-value", "nth": 0, "text": "11 days" } },
				{ "expect": { "node": "#label-stat-value", "nth": 2, "text": "1 / 5" } }
			]
		},
		{
			"name": "today-follows-the-checks",
			"note": "Today's square in the heatmap follows how many habits are done (the watch on doneToday)",
			"steps": [
				{ "expect": { "state": "weeks[19][3]", "is": 2 } },
				{ "click": "#habit", "nth": 2 },
				{ "click": "#habit", "nth": 3 },
				{ "expect": { "state": "weeks[19][3]", "is": 4 } },
				{ "expect": { "node": "#panel-level", "nth": 136, "property": "tooltip", "is": "4 habits", "note": "Thursday has no day label" } },
				{ "click": "#habit", "nth": 4 },
				{ "expect": { "state": "weeks[19][3]", "is": 4, "note": "five done still shows the darkest shade" } }
			]
		},
		{
			"name": "add-a-habit",
			"note": "Typing a name and pressing Enter adds an unchecked habit with the next colour",
			"steps": [
				{ "click": "#newHabit" },
				{ "type": "  Drink water " },
				{ "key": "enter" },
				{ "expect": { "state": "habits.length", "is": 6 } },
				{ "expect": { "state": "habits[5]", "is": { "name": "Drink water", "done": false, "streak": 0, "week": 0, "color": "#0891b2" } } },
				{ "expect": { "state": "newHabit", "is": "" } },
				{ "expect": { "node": "#label-habit-name", "nth": 5, "text": "Drink water" } },
				{ "expect": { "node": "#label-habit-streak-0", "nth": 5, "text": "Start today" } },
				{ "expect": { "node": "#doneCount", "text": "2 of 6 done" } }
			]
		},
		{
			"name": "ignore-a-blank-habit",
			"note": "Enter with an empty or blank name adds nothing; Cmd+N puts the keyboard in the field",
			"steps": [
				{ "key": "mod+n" },
				{ "wait": 0, "note": "the focus lands on the next frame" },
				{ "expect": { "node": "#newHabit", "property": "focused", "is": true } },
				{ "key": "enter" },
				{ "type": "    " },
				{ "key": "enter" },
				{ "expect": { "state": "habits.length", "is": 5 } },
				{ "expect": { "node": "#habit", "nth": 5, "exists": false } }
			]
		},
		{
			"name": "change-a-past-day",
			"note": "Clicking a day in the heatmap steps it to the next shade, wrapping from 4 back to 0",
			"steps": [
				{ "expect": { "node": "#panel-level", "nth": 0, "property": "tooltip", "is": "Mon: 2 habits" } },
				{ "click": "#panel-level", "nth": 0 },
				{ "expect": { "state": "weeks[0][0]", "is": 3 } },
				{ "expect": { "node": "#panel-level", "nth": 0, "property": "color", "is": "#16a34a" } },
				{ "click": "#panel-level", "nth": 0 },
				{ "click": "#panel-level", "nth": 0 },
				{ "expect": { "state": "weeks[0][0]", "is": 0 } },
				{ "expect": { "node": "#label-stat-value", "nth": 3, "text": "318", "note": "the 320 check-ins, less the 2 of that day" } }
			]
		},
		{
			"name": "switch-pages",
			"note": "The tabs and Cmd+1, Cmd+2, Cmd+3 switch between Today, History and Notes",
			"steps": [
				{ "click": [275, 50], "note": "History" },
				{ "expect": { "state": "tab", "is": "history" } },
				{ "expect": { "node": "#historyTable", "exists": true } },
				{ "expect": { "node": "#habits", "exists": false } },
				{ "key": "mod+3" },
				{ "expect": { "state": "tab", "is": "notes" } },
				{ "expect": { "node": "#notesList", "exists": true } },
				{ "key": "mod+1" },
				{ "expect": { "state": "tab", "is": "today" } }
			]
		},
		{
			"name": "switch-the-theme",
			"note": "The moon button and Cmd+J switch between the light and the dark tokens",
			"steps": [
				{ "click": [1236, 46] },
				{ "expect": { "state": "theme", "is": "dark" } },
				{ "key": "mod+j" },
				{ "expect": { "state": "theme", "is": "light" } }
			]
		},
		{
			"name": "sort-and-pick-the-history",
			"note": "The history table lists 137 days; a title sorts it, a row is picked",
			"steps": [
				{ "key": "mod+2" },
				{ "expect": { "node": "#historySummary", "text": "137 days  ·  47% on average  ·  click a title to sort" } },
				{ "click": [100, 236], "note": "the second row: yesterday" },
				{ "expect": { "state": "historyPick", "is": "1" } },
				{ "click": [1100, 174], "note": "the Score title" },
				{ "expect": { "state": "historySort.column", "is": "score" } },
				{ "key": "mod+1" },
				{ "key": "mod+2" },
				{ "expect": { "state": "historySort.column", "is": "score", "note": "kept across pages" } },
				{ "click": [1100, 174], "note": "Score again" },
				{ "expect": { "state": "historySort.descending", "is": true } },
				{ "expect": { "state": "historyPick", "is": "1", "note": "the pick stays on its day" } }
			]
		},
		{
			"name": "filter-notes-by-habit",
			"note": "A habit's name in a note is a link: it shows only that habit's notes, and Show all clears it",
			"steps": [
				{ "key": "mod+3" },
				{ "click": [181, 239], "note": "Run or walk 5 km, in the second note" },
				{ "expect": { "state": "noteFilter", "is": "Run or walk 5 km" } },
				{ "expect": { "node": "#noteFilter", "text": "Only the notes about Run or walk 5 km" } },
				{ "expect": { "node": "#note", "nth": 1, "exists": false } },
				{ "click": "#showAll" },
				{ "expect": { "state": "noteFilter", "is": "" } },
				{ "expect": { "node": "#note", "nth": 5, "exists": true } }
			]
		},
		{
			"name": "add-a-note",
			"note": "A note goes to the habit in the filter, or to the first habit, and shows at the top",
			"steps": [
				{ "key": "mod+3" },
				{ "click": "#newNote" },
				{ "type": "Ran in the park" },
				{ "key": "enter" },
				{ "expect": { "state": "notes.length", "is": 7 } },
				{ "expect": { "state": "notes[6].habit", "is": "Read 20 pages" } },
				{ "expect": { "state": "notes[6].date", "is": "Thu 15 Oct" } },
				{ "expect": { "state": "newNote", "is": "" } },
				{ "click": [181, 295], "note": "Run or walk 5 km, now in the third note" },
				{ "click": "#newNote" },
				{ "type": "Hills" },
				{ "key": "enter" },
				{ "expect": { "state": "notes[7].habit", "is": "Run or walk 5 km" } }
			]
		},
		{
			"name": "new-habit-dialog",
			"note": "Cmd+Shift+N asks for a name and a colour; Add saves it and says so in a toast",
			"steps": [
				{ "key": "mod+shift+n" },
				{ "wait": 50 },
				{ "expect": { "state": "draft.open", "is": true } },
				{ "type": "Stretch" },
				{ "click": "#swatch", "nth": 3 },
				{ "expect": { "state": "draft.color", "is": "#db2777" } },
				{ "click": [696, 490], "note": "Add" },
				{ "expect": { "state": "draft.open", "is": false } },
				{ "expect": { "state": "habits.length", "is": 6 } },
				{ "expect": { "state": "habits[5].color", "is": "#db2777" } },
				{ "expect": { "state": "toast.message", "is": "Added Stretch" } },
				{ "expect": { "state": "toast.open", "is": true } },
				{ "wait": 4100 },
				{ "expect": { "state": "toast.open", "is": false } }
			]
		},
		{
			"name": "new-habit-needs-a-name",
			"note": "Add with a blank name keeps the dialog open and adds nothing",
			"steps": [
				{ "click": "#newHabitButton" },
				{ "wait": 50 },
				{ "key": "enter" },
				{ "expect": { "state": "draft.open", "is": true } },
				{ "expect": { "state": "habits.length", "is": 5 } }
			]
		},
		{
			"name": "delete-a-habit",
			"note": "The bin asks first (without ticking the row); Delete removes the habit",
			"steps": [
				{ "click": "#deleteHabit", "nth": 1 },
				{ "wait": 50 },
				{ "expect": { "state": "deleting.open", "is": true } },
				{ "expect": { "state": "deleting.name", "is": "Run or walk 5 km" } },
				{ "expect": { "state": "habits[1].done", "is": true, "note": "the row's own click did not run" } },
				{ "click": [696, 452], "note": "Delete" },
				{ "expect": { "state": "deleting.open", "is": false } },
				{ "expect": { "state": "habits.length", "is": 4 } },
				{ "expect": { "state": "habits[1].name", "is": "Practise C++ for an hour" } },
				{ "expect": { "state": "toast.message", "is": "Deleted Run or walk 5 km" } }
			]
		},
		{
			"name": "cancel-a-delete",
			"note": "Escape closes the delete dialog and keeps the habit",
			"steps": [
				{ "click": "#deleteHabit", "nth": 0 },
				{ "wait": 50 },
				{ "key": "escape" },
				{ "expect": { "state": "deleting.open", "is": false } },
				{ "expect": { "state": "habits.length", "is": 5 } }
			]
		}
	]
}
