{
	"format": "affrescoui-scenarios",
	"version": 2,
	"screens": "../../../examples/code-editor",
	"scenarios": [
		{
			"name": "code-editor",
			"screen": "code-editor.screen.json",
			"steps": [
				{ "expect": { "image": "first-frame" } },
				{ "move": [340, 789] },
				{ "wait": 1200 },
				{ "expect": { "image": "tooltip" } },
				{ "click": [22, 14] },
				{ "wait": 50 },
				{ "expect": { "image": "menu-open" } },
				{ "key": "escape" },
				{ "click": [130, 270] },
				{ "expect": { "image": "file-opened" } },
				{ "click": [472, 42] },
				{ "click": "#editor" },
				{ "key": "cmd+down" },
				{ "expect": { "image": "large-file" } },
				{ "key": "cmd+p" },
				{ "wait": 50 },
				{ "type": "st" },
				{ "wait": 50 },
				{ "expect": { "image": "quick-open" } },
				{ "key": "escape" },
				{ "key": "cmd+shift+p" },
				{ "wait": 50 },
				{ "expect": { "image": "command-palette" } },
				{ "key": "escape" },
				{ "click": [267, 42] },
				{ "click": "#editor" },
				{ "type": "x" },
				{ "key": "cmd+w" },
				{ "wait": 50 },
				{ "expect": { "image": "close-dialog" } },
				{ "click": [792, 447] },
				{ "key": "cmd+j" },
				{ "wait": 0 },
				{ "click": "#command" },
				{ "type": "help" },
				{ "key": "enter" },
				{ "expect": { "image": "terminal-help" } }
			]
		},
		{
			"name": "code-editing",
			"screen": "code-editor.screen.json",
			"steps": [
				{ "click": [900, 166] },
				{ "key": "enter" },
				{ "type": "int x = (1" },
				{ "type": ");" },
				{ "expect": { "image": "typed" } },
				{ "key": "shift+up" },
				{ "key": "shift+up" },
				{ "key": "cmd+slash" },
				{ "expect": { "image": "commented" } },
				{ "key": "alt+down" },
				{ "expect": { "image": "moved" } },
				{ "key": "cmd+z" },
				{ "key": "cmd+z" },
				{ "key": "cmd+s" },
				{ "expect": { "image": "undone-saved" } }
			]
		}
	]
}
