{
	"format": "affrescoui-scenarios",
	"version": 2,
	"screens": "../screens",
	"scenarios": [
		{
			"name": "visuals",
			"screen": "visuals.screen.json",
			"note": "Images (PNG and JPEG, each fit, packed and alone) and icons (in a fallback font and a font of their own); a revision that changes an image's file and fit, and an icon; an icon button's hover colour",
			"steps": [
				{ "expect": { "image": "first-frame" } },
				{ "revision": { "message": "Another picture, another fit, another icon", "set": {
					"#contain/file": "images/banner.png",
					"#fill/fit": "contain",
					"#bell/icon": "bell-ring"
				} } },
				{ "expect": { "image": "revised" } },
				{ "move": "#settings" },
				{ "expect": { "image": "icon-hover" } }
			]
		},
		{
			"name": "visuals-retina",
			"screen": "visuals.screen.json",
			"scale": 2,
			"note": "Images and icons at two pixels per window unit",
			"steps": [{ "expect": { "image": "first-frame" } }]
		}
	]
}
