{
	"format": "affrescoui-scenarios",
	"version": 2,
	"screens": "../screens",
	"scenarios": [
		{
			"name": "tokens",
			"screen": "tokens.screen.json",
			"note": "Design tokens: the first frame, the dark theme (colour roles switch), then one small edit to three tokens that restyles every card",
			"steps": [
				{ "expect": { "image": "first-frame" } },
				{ "revision": { "message": "Dark theme", "set": { "/state/theme": "dark" } } },
				{ "expect": { "image": "dark" } },
				{
					"revision": {
						"message": "Roomier and rounder, in another accent",
						"set": {
							"/tokens/space.s": 16,
							"/tokens/radius.card": 22,
							"/colors/brand": "#db2777"
						}
					}
				},
				{ "expect": { "image": "restyled" } }
			]
		}
	]
}
