{
	"format": "affrescoui-scenarios",
	"version": 2,
	"screens": "../screens",
	"scenarios": [
		{
			"name": "unicode",
			"screen": "unicode.screen.json",
			"steps": [
				{ "expect": { "image": "first-frame" } },
				{ "click": "#editor" },
				{ "key": "end" },
				{ "key": "shift+left" },
				{ "key": "shift+left" },
				{ "key": "shift+left" },
				{ "key": "shift+left" },
				{ "key": "shift+left" },
				{ "expect": { "image": "selected" } },
				{ "key": "backspace" },
				{ "type": "World" },
				{ "expect": { "image": "edited" } }
			]
		}
	]
}
