{
	"format": "affrescoui-scenarios",
	"version": 1,
	"screens": "../screens",
	"scenarios": [
		{
			"name": "scripts",
			"screen": "scripts.screen.json",
			"steps": [
				{ "expect": { "image": "first-frame" } },
				{ "click": "#editor" },
				{ "key": "home" },
				{ "key": "right" },
				{ "key": "right" },
				{ "key": "right" },
				{ "key": "right" },
				{ "key": "right" },
				{ "key": "right" },
				{ "key": "right" },
				{ "key": "right" },
				{ "key": "right" },
				{ "key": "right" },
				{ "key": "right" },
				{ "key": "right" },
				{ "key": "right" },
				{ "key": "right" },
				{ "key": "right" },
				{ "key": "right" },
				{ "key": "right" },
				{ "key": "right" },
				{ "key": "right" },
				{ "key": "right" },
				{ "key": "right" },
				{ "key": "right" },
				{ "key": "right" },
				{ "key": "shift+right" },
				{ "key": "shift+right" },
				{ "expect": { "image": "inside-ligature" } },
				{ "key": "end" },
				{ "key": "shift+left" },
				{ "key": "shift+left" },
				{ "key": "shift+left" },
				{ "key": "shift+left" },
				{ "key": "shift+left" },
				{ "key": "shift+left" },
				{ "expect": { "image": "selected" } },
				{ "type": "x" },
				{ "expect": { "image": "edited" } }
			]
		}
	]
}
